{
  "$schema": "http://json-schema.org/draft-07/schema#",
  "title": "Universal ML Benchmark Results",
  "type": "object",
  "required": ["_meta", "device", "performance", "benchmark"],
  "properties": {
    "_meta": {
      "type": "object",
      "required": ["Source version", "Source code", "Source repo", "Test date", "Tester", "Firmware", "Notes"],
      "properties": {
        "Source version": { "type": "string" },
        "Source code": { "type": "string" },
        "Source repo": { "type": "string" },
        "Test date": { "type": "string", "format": "date" },
        "Tester": { "type": "string" },
        "Firmware": { "type": "string" },
        "Notes": { "type": "string" }
      }
    },
    "device": {
      "type": "object",
      "required": ["board_type", "cpu_freq_mhz", "num_cores", "temp_sensor", "power_sensor"],
      "properties": {
        "board_type": { "type": "string" },
        "cpu_freq_mhz": { "type": "number" },
        "num_cores": { "type": "integer" },
        "temp_sensor": { "type": "boolean" },
        "power_sensor": { "type": "boolean" }
      }
    },
    "performance": {
      "type": "object",
      "required": ["channels", "array_size", "memory_total", "memory_used", "min_inference_ms", "max_inference_ms", "avg_inference_ms", "throughput_fps"],
      "properties": {
        "channels": { "type": "integer" },
        "array_size": { "type": "integer" },
        "memory_total": { "type": "number" },
        "memory_used": { "type": "number" },
        "min_inference_ms": { "type": "number" },
        "max_inference_ms": { "type": "number" },
        "avg_inference_ms": { "type": "number" },
        "throughput_fps": { "type": "number" },
        "avg_temperature": { "type": "number" },
        "max_temperature": { "type": "number" },
        "avg_power_usage": { "type": "number" },
        "max_power_usage": { "type": "number" }
      }
    },
    "benchmark": {
      "type": "object",
      "required": ["total_ops", "ops_per_second", "normalized_score", "theoretical_power"],
      "properties": {
        "total_ops": {
          "type": "number",
          "description": "Total operations calculated as (array_size^3 * channels + array_size^2 * channels * 2), where the *2 accounts for element-wise scaling and addition"
        },
        "ops_per_second": {
          "type": "number",
          "description": "Calculated as total_ops / (avg_inference_ms / 1000)"
        },
        "normalized_score": {
          "type": "number",
          "description": "Calculated as ops_per_second / cpu_freq_mhz"
        },
        "theoretical_power": {
          "type": "number",
          "description": "Calculated as normalized_score * cpu_freq_mhz * num_cores"
        }
      }
    }
  }
}
