{
    "_meta": {
        "Source version": "0.1",
        "Source code": "https://github.com/platima/ml-accelerator-benchmark/blob/816c4b2387aaf601e4a23f96c9798f3b306a766d/micropython-benchmark.py",
        "Source repo": "https://github.com/platima/ml-accelerator-benchmark",
        "Test date": "2025-01-10",
        "Tester": "Platima",
        "Firmware": "https://github.com/pimoroni/pimoroni-pico-rp2350/releases/download/v0.0.11/pico2-v0.0.11-pimoroni-micropython.uf2",
        "Notes": "'benchmark' data added retrospectively by manual calculation"
    },
    "device": {
        "board_type": "rp2350",
        "cpu_freq_mhz": 150,
        "num_cores": 2,
        "temp_sensor": true,
        "power_sensor": true
    },
    "performance": {
        "channels": 3,
        "array_size": 134,
        "memory_total": 480160,
        "memory_used": 288096,
        "min_inference_ms": 1759,
        "max_inference_ms": 1770,
        "avg_inference_ms": 1760.100,
        "throughput_fps": 0.568,
        "avg_temperature": 26.529,
        "max_temperature": 27.044
    },
    "benchmark": {
        "total_ops": 7332828,
        "ops_per_second": 4166143,
        "normalized_score": 27774.29,
        "theoretical_power": 8332287
    }
}