{
    "_meta": {
        "Source version": "0.2",
        "Source code": "https://github.com/platima/ml-accelerator-benchmark/blob/67dbe138fe7a2f0ed16ccbcd8ec3fcaaa4ba4b33/benchmarks/circuitpython_benchmark.py",
        "Source repo": "https://github.com/platima/ml-accelerator-benchmark",
        "Test date": "2025-01-18",
        "Tester": "Platima",
        "Firmware": "https://downloads.circuitpython.org/bin/espressif_esp32p4_function_ev/en_US/adafruit-circuitpython-espressif_esp32p4_function_ev-en_US-9.2.3.bin",
        "Notes": ""
    },
    "device": {
        "board_type": "espressif_esp32p4_function_ev",
        "cpu_freq_mhz": 360.000,
        "num_cores": 1,
        "temp_sensor": true,
        "power_sensor": false
    },
    "performance": {
        "channels": 3,
        "array_size": 256,
        "memory_total": 33084336,
        "memory_used": 2438320,
        "min_inference_ms": 28097.930,
        "max_inference_ms": 28139.125,
        "avg_inference_ms": 28118.750,
        "throughput_fps": 0.036,
        "avg_temperature": 32.000,
        "max_temperature": 32.000
    },
    "benchmark": {
        "total_ops": 50724864,
        "ops_per_second": 1803952.000,
        "normalized_score": 5010.977,
        "theoretical_power": 1803951.500
    }
}
